{"$defs":{"advisory":{"maxLength":100,"pattern":"^ADVISORY-[A-Z0-9]+(?:-[A-Z0-9]+){0,7}$","type":"string"},"coordinate":{"additionalProperties":false,"properties":{"ecosystem":{"enum":["cargo","gradle","maven"]},"name":{"maxLength":300,"pattern":"^[A-Za-z0-9][A-Za-z0-9_.-]{0,199}(?::[A-Za-z0-9][A-Za-z0-9_.-]{0,99})?$","type":"string"},"version":{"maxLength":100,"pattern":"^(?!.*(?:^|[._+-])(?:[lL][aA][tT][eE][sS][tT]|[mM][aA][iI][nN]|[hH][eE][aA][dD]|[mM][aA][sS][tT][eE][rR]|[nN][iI][gG][hH][tT][lL][yY]|[rR][eE][lL][eE][aA][sS][eE]|[sS][nN][aA][pP][sS][hH][oO][tT]|[xX])(?:$|[._+-]))[0-9][0-9A-Za-z]*(?:[._+-][0-9A-Za-z]+)*$","type":"string"}},"required":["ecosystem","name","version"],"type":"object"},"database":{"maxLength":100,"pattern":"^DATABASE-[A-Z0-9]+(?:-[A-Z0-9]+){0,7}$","type":"string"},"file":{"additionalProperties":false,"properties":{"path":{"maxLength":240,"pattern":"^(?!/)(?!.*(?:^|/)\\.{1,2}(?:/|$))(?!.*//)(?!.*\\\\).+$","type":"string"},"sha256":{"$ref":"#/$defs/hash"}},"required":["path","sha256"],"type":"object"},"hash":{"pattern":"^[0-9a-f]{64}$","type":"string"},"identifier":{"maxLength":100,"pattern":"^[A-Z][A-Z0-9]*(?:-[A-Z0-9]+){1,8}$","type":"string"},"observation":{"maxLength":100,"pattern":"^OBSERVATION-[A-Z0-9]+(?:-[A-Z0-9]+){0,7}$","type":"string"},"reachability":{"enum":["reachable","unreachable","unknown"]},"scope":{"enum":["build","development","production","test"]},"timestamp":{"format":"date-time","pattern":"^[0-9]{4}-[0-9]{2}-[0-9]{2}T[0-9]{2}:[0-9]{2}:[0-9]{2}Z$","type":"string"},"workspace":{"maxLength":100,"pattern":"^WORKSPACE-[A-Z0-9]+(?:-[A-Z0-9]+){0,7}$","type":"string"}},"$id":"https://github.com/martin-beck/agent-workflow-quality/schemas/vulnerability-supply.schema.json","$schema":"https://json-schema.org/draft/2020-12/schema","additionalProperties":false,"properties":{"advisory_databases":{"items":{"additionalProperties":false,"properties":{"acquisition":{"const":"scheduled-snapshot"},"ecosystem":{"enum":["cargo","gradle","maven"]},"expires_at":{"$ref":"#/$defs/timestamp"},"id":{"$ref":"#/$defs/database"},"observed_at":{"$ref":"#/$defs/timestamp"},"revision_sha256":{"$ref":"#/$defs/hash"},"scanner_id":{"maxLength":100,"pattern":"^SCANNER-[A-Z0-9]+(?:-[A-Z0-9]+){0,7}$","type":"string"},"scanner_version":{"maxLength":100,"pattern":"^(?!.*(?:^|[._+-])(?:[dD][eE][vV]|[hH][eE][aA][dD]|[lL][aA][tT][eE][sS][tT]|[mM][aA][iI][nN]|[mM][aA][sS][tT][eE][rR]|[nN][iI][gG][hH][tT][lL][yY]|[rR][eE][lL][eE][aA][sS][eE]|[sS][nN][aA][pP][sS][hH][oO][tT]|[tT][iI][pP]|[tT][rR][uU][nN][kK]|[xX])[0-9]*(?:$|[._+-]))[0-9]+(?:\\.[0-9]+){1,3}(?:[-+][0-9A-Za-z]+(?:[.-][0-9A-Za-z]+)*)?$","type":"string"},"snapshot_sha256":{"$ref":"#/$defs/hash"}},"required":["id","ecosystem","scanner_id","scanner_version","revision_sha256","snapshot_sha256","observed_at","expires_at","acquisition"],"type":"object"},"maxItems":32,"minItems":1,"type":"array"},"exceptions":{"items":{"additionalProperties":false,"properties":{"advisory_id":{"$ref":"#/$defs/advisory"},"compensating_evidence_sha256":{"$ref":"#/$defs/hash"},"coordinate":{"$ref":"#/$defs/coordinate"},"created_at":{"$ref":"#/$defs/timestamp"},"expires_at":{"$ref":"#/$defs/timestamp"},"id":{"maxLength":100,"pattern":"^EXCEPTION-[A-Z0-9]+(?:-[A-Z0-9]+){0,7}$","type":"string"},"lock_sha256":{"$ref":"#/$defs/hash"},"observation_id":{"$ref":"#/$defs/observation"},"owner":{"maxLength":100,"pattern":"^OWNER-[A-Z0-9]+(?:-[A-Z0-9]+){0,7}$","type":"string"},"rationale":{"maxLength":500,"minLength":20,"pattern":"^[^\\r\\n]+$","type":"string"},"reachability":{"$ref":"#/$defs/reachability"},"review_id":{"maxLength":100,"pattern":"^REVIEW-[A-Z0-9]+(?:-[A-Z0-9]+){0,7}$","type":"string"},"scope":{"$ref":"#/$defs/scope"},"workspace_id":{"$ref":"#/$defs/workspace"}},"required":["id","observation_id","advisory_id","workspace_id","coordinate","scope","reachability","lock_sha256","owner","rationale","review_id","compensating_evidence_sha256","created_at","expires_at"],"type":"object"},"maxItems":512,"type":"array"},"executed_workspace_ids":{"items":{"$ref":"#/$defs/workspace"},"maxItems":64,"minItems":1,"type":"array","uniqueItems":true},"kind":{"const":"vulnerability-supply"},"observations":{"items":{"additionalProperties":false,"properties":{"advisory_id":{"$ref":"#/$defs/advisory"},"aliases":{"items":{"$ref":"#/$defs/advisory"},"maxItems":16,"type":"array","uniqueItems":true},"coordinate":{"$ref":"#/$defs/coordinate"},"database_id":{"$ref":"#/$defs/database"},"id":{"$ref":"#/$defs/observation"},"lock_sha256":{"$ref":"#/$defs/hash"},"reachability":{"$ref":"#/$defs/reachability"},"scope":{"$ref":"#/$defs/scope"},"status":{"enum":["affected","not-affected"]},"workspace_id":{"$ref":"#/$defs/workspace"}},"required":["id","database_id","workspace_id","advisory_id","aliases","coordinate","scope","reachability","lock_sha256","status"],"type":"object"},"maxItems":4096,"minItems":1,"type":"array"},"schema_version":{"const":1},"workspaces":{"items":{"additionalProperties":false,"properties":{"dependencies":{"items":{"additionalProperties":false,"properties":{"coordinate":{"$ref":"#/$defs/coordinate"},"reachability":{"$ref":"#/$defs/reachability"},"scope":{"$ref":"#/$defs/scope"}},"required":["coordinate","scope","reachability"],"type":"object"},"maxItems":2048,"minItems":1,"type":"array","uniqueItems":true},"ecosystem":{"enum":["cargo","gradle","maven"]},"evidence_sha256":{"$ref":"#/$defs/hash"},"id":{"$ref":"#/$defs/workspace"},"lock":{"$ref":"#/$defs/file"},"manifest":{"$ref":"#/$defs/file"},"policy":{"$ref":"#/$defs/file"},"role":{"enum":["application","fuzz","test","tooling"]}},"required":["id","ecosystem","role","manifest","lock","policy","dependencies","evidence_sha256"],"type":"object"},"maxItems":64,"minItems":1,"type":"array"}},"required":["schema_version","kind","advisory_databases","workspaces","executed_workspace_ids","observations","exceptions"],"title":"Cross-ecosystem vulnerability observation and workspace supply policy","type":"object"}
