{"advisory_databases":[{"acquisition":"scheduled-snapshot","ecosystem":"gradle","expires_at":"2026-10-01T00:00:00Z","id":"DATABASE-OSV-JVM","observed_at":"2026-09-01T00:00:00Z","revision_sha256":"1111111111111111111111111111111111111111111111111111111111111111","scanner_id":"SCANNER-OSV-SNAPSHOT","scanner_version":"1.2.0","snapshot_sha256":"2222222222222222222222222222222222222222222222222222222222222222"},{"acquisition":"scheduled-snapshot","ecosystem":"cargo","expires_at":"2026-10-01T00:00:00Z","id":"DATABASE-RUSTSEC","observed_at":"2026-09-01T00:00:00Z","revision_sha256":"3333333333333333333333333333333333333333333333333333333333333333","scanner_id":"SCANNER-CARGO-AUDIT","scanner_version":"0.22.2","snapshot_sha256":"4444444444444444444444444444444444444444444444444444444444444444"}],"exceptions":[{"advisory_id":"ADVISORY-RUSTSEC-2026-0001","compensating_evidence_sha256":"5555555555555555555555555555555555555555555555555555555555555555","coordinate":{"ecosystem":"cargo","name":"time","version":"0.3.41"},"created_at":"2026-09-05T00:00:00Z","expires_at":"2026-09-20T00:00:00Z","id":"EXCEPTION-RUST-TIME","lock_sha256":"6666666666666666666666666666666666666666666666666666666666666666","observation_id":"OBSERVATION-RUST-ROOT","owner":"OWNER-SECURITY-TEAM","rationale":"Deployment controls prevent the affected feature from being invoked.","reachability":"reachable","review_id":"REVIEW-SECURITY-104","scope":"production","workspace_id":"WORKSPACE-RUST-ROOT"}],"executed_workspace_ids":["WORKSPACE-JVM-APP","WORKSPACE-RUST-FUZZ","WORKSPACE-RUST-ROOT"],"kind":"vulnerability-supply","observations":[{"advisory_id":"ADVISORY-CVE-2026-1000","aliases":["ADVISORY-GHSA-AAAA-BBBB-CCCC"],"coordinate":{"ecosystem":"gradle","name":"com.fasterxml.jackson.core:jackson-databind","version":"2.18.3"},"database_id":"DATABASE-OSV-JVM","id":"OBSERVATION-JVM-APP","lock_sha256":"7777777777777777777777777777777777777777777777777777777777777777","reachability":"unknown","scope":"production","status":"not-affected","workspace_id":"WORKSPACE-JVM-APP"},{"advisory_id":"ADVISORY-RUSTSEC-2026-0002","aliases":[],"coordinate":{"ecosystem":"cargo","name":"libfuzzer-sys","version":"0.4.9"},"database_id":"DATABASE-RUSTSEC","id":"OBSERVATION-RUST-FUZZ","lock_sha256":"8888888888888888888888888888888888888888888888888888888888888888","reachability":"reachable","scope":"test","status":"not-affected","workspace_id":"WORKSPACE-RUST-FUZZ"},{"advisory_id":"ADVISORY-RUSTSEC-2026-0001","aliases":["ADVISORY-CVE-2026-2000"],"coordinate":{"ecosystem":"cargo","name":"time","version":"0.3.41"},"database_id":"DATABASE-RUSTSEC","id":"OBSERVATION-RUST-ROOT","lock_sha256":"6666666666666666666666666666666666666666666666666666666666666666","reachability":"reachable","scope":"production","status":"affected","workspace_id":"WORKSPACE-RUST-ROOT"}],"schema_version":1,"workspaces":[{"dependencies":[{"coordinate":{"ecosystem":"gradle","name":"com.fasterxml.jackson.core:jackson-databind","version":"2.18.3"},"reachability":"unknown","scope":"production"}],"ecosystem":"gradle","evidence_sha256":"9999999999999999999999999999999999999999999999999999999999999999","id":"WORKSPACE-JVM-APP","lock":{"path":"app/gradle.lockfile","sha256":"7777777777777777777777777777777777777777777777777777777777777777"},"manifest":{"path":"build.gradle.kts","sha256":"aaaaaaaaaaaaaaaaaaaaaaaaaaaaaaaaaaaaaaaaaaaaaaaaaaaaaaaaaaaaaaaa"},"policy":{"path":"gradle/verification-metadata.xml","sha256":"bbbbbbbbbbbbbbbbbbbbbbbbbbbbbbbbbbbbbbbbbbbbbbbbbbbbbbbbbbbbbbbb"},"role":"application"},{"dependencies":[{"coordinate":{"ecosystem":"cargo","name":"libfuzzer-sys","version":"0.4.9"},"reachability":"reachable","scope":"test"}],"ecosystem":"cargo","evidence_sha256":"cccccccccccccccccccccccccccccccccccccccccccccccccccccccccccccccc","id":"WORKSPACE-RUST-FUZZ","lock":{"path":"fuzz/Cargo.lock","sha256":"8888888888888888888888888888888888888888888888888888888888888888"},"manifest":{"path":"fuzz/Cargo.toml","sha256":"dddddddddddddddddddddddddddddddddddddddddddddddddddddddddddddddd"},"policy":{"path":"quality/rust-fuzz-supply.json","sha256":"eeeeeeeeeeeeeeeeeeeeeeeeeeeeeeeeeeeeeeeeeeeeeeeeeeeeeeeeeeeeeeee"},"role":"fuzz"},{"dependencies":[{"coordinate":{"ecosystem":"cargo","name":"time","version":"0.3.41"},"reachability":"reachable","scope":"production"}],"ecosystem":"cargo","evidence_sha256":"ffffffffffffffffffffffffffffffffffffffffffffffffffffffffffffffff","id":"WORKSPACE-RUST-ROOT","lock":{"path":"Cargo.lock","sha256":"6666666666666666666666666666666666666666666666666666666666666666"},"manifest":{"path":"Cargo.toml","sha256":"0123456789abcdef0123456789abcdef0123456789abcdef0123456789abcdef"},"policy":{"path":"deny.toml","sha256":"abcdef0123456789abcdef0123456789abcdef0123456789abcdef0123456789"},"role":"application"}]}
